{
  "schemaVersion": "1.1",
  "intentId": "why-ppagent-users",
  "purposeKey": "explain_topics",
  "purposeText": "围绕目标用户呈现其已有条件和能力缺口。",
  "baseRelation": "hub",
  "relationTraits": {
    "temporal": false,
    "cyclic": false,
    "converging": false,
    "branched": false,
    "dimensions": 1,
    "secondaryDimension": "none"
  },
  "structure": {
    "itemCount": 4,
    "ordered": false,
    "sameLevel": true
  },
  "density": "low",
  "evidenceTypes": [
    "text",
    "diagram"
  ],
  "confidence": 0.98,
  "assumptions": [],
  "contentStats": {
    "titleChars": 28,
    "itemCount": 4,
    "maxItemChars": 16,
    "avgItemChars": 13.25,
    "minItemChars": 11,
    "maxItemTitleChars": 6,
    "maxItemBodyChars": 10,
    "imbalanceRatio": 1.45
  }
}
